{
  "schemaVersion": "v1",
  "title": "Sum of the first n odd numbers",
  "note": "Example data. Lean file examples/lean/SumOdd.lean; it has not been compiled with Lean in this repo, the compiler output is illustrative.",
  "objects": [
    {
      "id": "Q-0001",
      "type": "question",
      "revision": 1,
      "createdAt": "2026-10-20T09:00:00Z",
      "createdBy": {
        "kind": "human",
        "userId": "u-example"
      },
      "title": "Is the sum of the first n odd numbers n² for every n?",
      "domain": "math",
      "scope": "Natural numbers; formal proof in Lean 4 + Mathlib",
      "tags": [
        "sums",
        "induction"
      ]
    },
    {
      "id": "ART-0001",
      "type": "artifact",
      "revision": 1,
      "createdAt": "2026-10-20T09:05:00Z",
      "createdBy": {
        "kind": "agent",
        "role": "literature",
        "model": "anthropic/claude-sonnet-5-5",
        "modelFamily": "anthropic"
      },
      "kind": "paper",
      "uri": "mathlib:Finset.sum_range_succ",
      "provider": "other",
      "citationVerified": true
    },
    {
      "id": "H-0001",
      "type": "hypothesis",
      "revision": 1,
      "createdAt": "2026-10-20T09:10:00Z",
      "createdBy": {
        "kind": "agent",
        "role": "hypothesis",
        "model": "anthropic/claude-sonnet-5-5",
        "modelFamily": "anthropic"
      },
      "questionId": "Q-0001",
      "statement": "For every natural number n, ∑_{i<n} (2i+1) = n² holds.",
      "falsifiabilityNote": "A single n that breaks the equality, or a proof that does not compile in Lean, refutes the hypothesis.",
      "status": "supported",
      "approval": {
        "by": {
          "kind": "human",
          "userId": "u-example"
        },
        "at": "2026-10-20T09:12:00Z",
        "decision": "approved",
        "autonomyLevel": "manual"
      }
    },
    {
      "id": "PRE-0001",
      "type": "preregistration",
      "revision": 1,
      "createdAt": "2026-10-20T09:20:00Z",
      "createdBy": {
        "kind": "agent",
        "role": "experiment_designer",
        "model": "anthropic/claude-sonnet-5-5",
        "modelFamily": "anthropic"
      },
      "hypothesisId": "H-0001",
      "primaryMetric": "lean_compiles_without_sorry",
      "successCriterion": "The theorem compiles with Lean 4 + Mathlib without sorry.",
      "analysisPlan": "The compiler output must contain no sorry and no errors; the Verifier recompiles in a clean environment.",
      "lockedAt": "2026-10-20T09:21:00Z",
      "contentHash": "0076676fa8bd3245d285b47dd5e4b44cfc4170b495f2c4767cace2a435e30653"
    },
    {
      "id": "E-0001",
      "type": "experiment",
      "revision": 1,
      "createdAt": "2026-10-20T09:15:00Z",
      "createdBy": {
        "kind": "agent",
        "role": "experiment_designer",
        "model": "anthropic/claude-sonnet-5-5",
        "modelFamily": "anthropic"
      },
      "hypothesisIds": [
        "H-0001"
      ],
      "domain": "math",
      "method": "Lean 4 proof by induction on n; Finset.sum_range_succ and the ring tactic.",
      "metrics": [
        {
          "name": "lean_compiles_without_sorry",
          "direction": "binary"
        }
      ],
      "lean": {
        "toolchain": "leanprover/lean4:v4.x (example)",
        "mathlibRev": "example-revision"
      },
      "budget": {
        "estimatedUsd": 0.4,
        "approvedUsd": 1.0
      },
      "noveltyCheck": {
        "verdict": "already_done",
        "summary": "A known result; replicated as an end-to-end test of the engine.",
        "userChoice": "replicate"
      },
      "preregistrationId": "PRE-0001",
      "status": "completed",
      "approval": {
        "by": {
          "kind": "human",
          "userId": "u-example"
        },
        "at": "2026-10-20T09:22:00Z",
        "decision": "approved",
        "autonomyLevel": "manual"
      }
    },
    {
      "id": "RUN-0001",
      "type": "run",
      "revision": 1,
      "createdAt": "2026-10-20T09:25:00Z",
      "createdBy": {
        "kind": "agent",
        "role": "engineer",
        "model": "anthropic/claude-sonnet-5-5",
        "modelFamily": "anthropic"
      },
      "experimentId": "E-0001",
      "kind": "pilot",
      "status": "succeeded",
      "seed": 0,
      "startedAt": "2026-10-20T09:25:00Z",
      "endedAt": "2026-10-20T09:26:00Z",
      "cost": {
        "usd": 0.05
      }
    },
    {
      "id": "ART-0002",
      "type": "artifact",
      "revision": 1,
      "createdAt": "2026-10-20T09:31:00Z",
      "createdBy": {
        "kind": "agent",
        "role": "engineer",
        "model": "anthropic/claude-sonnet-5-5",
        "modelFamily": "anthropic"
      },
      "kind": "lean_output",
      "uri": "examples/lean/SumOdd.lean",
      "provider": "local",
      "sha256": "12431ed6fa714d56e6132bbbfe15963d705d236dd40ae3c43d1ac545001a53e4"
    },
    {
      "id": "RUN-0002",
      "type": "run",
      "revision": 1,
      "createdAt": "2026-10-20T09:28:00Z",
      "createdBy": {
        "kind": "agent",
        "role": "engineer",
        "model": "anthropic/claude-sonnet-5-5",
        "modelFamily": "anthropic"
      },
      "experimentId": "E-0001",
      "kind": "full",
      "status": "succeeded",
      "seed": 0,
      "startedAt": "2026-10-20T09:28:00Z",
      "endedAt": "2026-10-20T09:31:00Z",
      "logs": "ART-0002",
      "cost": {
        "usd": 0.21
      }
    },
    {
      "id": "RES-0001",
      "type": "result",
      "revision": 1,
      "createdAt": "2026-10-20T09:35:00Z",
      "createdBy": {
        "kind": "agent",
        "role": "analyst",
        "model": "anthropic/claude-sonnet-5-5",
        "modelFamily": "anthropic"
      },
      "experimentId": "E-0001",
      "runIds": [
        "RUN-0002"
      ],
      "summary": "Theorem sum_first_odds compiled without sorry.",
      "limitations": [
        "The proof relies on existing Mathlib lemmas."
      ],
      "leanProof": {
        "verified": true,
        "sorryFree": true,
        "compilerOutput": "ART-0002",
        "theoremName": "sum_first_odds"
      }
    },
    {
      "id": "CR-0001",
      "type": "critique",
      "revision": 1,
      "createdAt": "2026-10-20T09:38:00Z",
      "createdBy": {
        "kind": "agent",
        "role": "critic",
        "model": "provider-b/model-b",
        "modelFamily": "provider-b"
      },
      "targetId": "H-0001",
      "category": "overclaim",
      "severity": "low",
      "body": "The hypothesis text does not say whether the sum starts at 0 or 1; it should be aligned with the Lean statement.",
      "blindReview": true,
      "status": "resolved",
      "resolution": {
        "by": {
          "kind": "agent",
          "role": "hypothesis",
          "model": "anthropic/claude-sonnet-5-5",
          "modelFamily": "anthropic"
        },
        "at": "2026-10-20T09:40:00Z",
        "text": "The statement was rewritten as ∑_{i<n}; it now matches the Lean theorem exactly."
      }
    },
    {
      "id": "MSG-0001",
      "type": "message",
      "revision": 1,
      "createdAt": "2026-10-20T09:38:00Z",
      "createdBy": {
        "kind": "agent",
        "role": "critic",
        "model": "provider-b/model-b",
        "modelFamily": "provider-b"
      },
      "kind": "objection",
      "to": "hypothesis",
      "subjectId": "CR-0001",
      "body": "The starting index of the sum is ambiguous.",
      "round": 1,
      "requiresResponse": true
    },
    {
      "id": "MSG-0002",
      "type": "message",
      "revision": 1,
      "createdAt": "2026-10-20T09:40:00Z",
      "createdBy": {
        "kind": "agent",
        "role": "hypothesis",
        "model": "anthropic/claude-sonnet-5-5",
        "modelFamily": "anthropic"
      },
      "kind": "response",
      "to": "critic",
      "subjectId": "CR-0001",
      "inReplyTo": "MSG-0001",
      "body": "Accepted; the statement was aligned with the Lean theorem.",
      "round": 1
    },
    {
      "id": "RUN-0003",
      "type": "run",
      "revision": 1,
      "createdAt": "2026-10-20T09:45:00Z",
      "createdBy": {
        "kind": "agent",
        "role": "verifier",
        "model": "provider-b/model-b",
        "modelFamily": "provider-b"
      },
      "experimentId": "E-0001",
      "kind": "verification",
      "status": "succeeded",
      "seed": 0,
      "startedAt": "2026-10-20T09:45:00Z",
      "endedAt": "2026-10-20T09:48:00Z"
    },
    {
      "id": "VER-0001",
      "type": "verification",
      "revision": 1,
      "createdAt": "2026-10-20T09:49:00Z",
      "createdBy": {
        "kind": "agent",
        "role": "verifier",
        "model": "provider-b/model-b",
        "modelFamily": "provider-b"
      },
      "resultId": "RES-0001",
      "verificationRunIds": [
        "RUN-0003"
      ],
      "reproduced": "yes",
      "crossModel": true
    },
    {
      "id": "EL-0001",
      "type": "evidence_link",
      "revision": 1,
      "createdAt": "2026-10-20T09:50:00Z",
      "createdBy": {
        "kind": "agent",
        "role": "analyst",
        "model": "anthropic/claude-sonnet-5-5",
        "modelFamily": "anthropic"
      },
      "resultId": "RES-0001",
      "hypothesisId": "H-0001",
      "relation": "supports",
      "independence": "L1",
      "context": "Formal proof; recompiled in a clean environment by a different model family."
    }
  ]
}